Topic_id,Themes,Top_ten_words,Documents,Frequency_of_each_topic,Percentage_of_each_topic,Top_responses
1,"Sanoa, Osaa, Mitään","sanoa, osaa, mitään, enpä, oikein, kehitettävää, tyytyväinen, vastata, näin, hetkellä","['En osaa sanoa', 'En osaa sanoa', 'En osaa sanoa', 'En osaa sanoa', 'En osaa sanoa.', 'No enpä osaa sanoa', 'En osaa sanoa kaikki sp mainokset rasittaa kun niitä joutuu poistamaan. MinullacEi ole aikaa lukea mainoksia. Tilaan kirjan netistä jos näen hyvän seurakunnan kirjakaupassa tai sattumalta käyn sivulla.', 'Ulkoasun selkeytys', 'Vaikea sanoa mitää. kun KristillinenKirjakauppa.fi on tuntematon juttu. Kuvalta ja Sanalta olen tilannut tavaraa ja Radio Deistä + eräästä tamperelaisesta kr:stä kirjakaupasta. Hyvin olen löytänyt myös Huuto.netistä ja Facebookin kirjaryhmistä. Posti on pahin kilpailijanne.   :)', 'En kyllä osaa sanoa tähän mitään.', 'En osaa sanoa.', 'En osaa sanoa.', 'En osaa sanoa', 'En osaa sanoa', 'En osaa sanoa', 'En osaa sanoa', 'En osaa sanoa', 'En osaa sanoa', 'Vaikea sanoa- minusta tuntuu- että kr kirjakauppa ei ole mulle ollenkaan tuttu', 'Lisäys vastauksiini: En edes muista tilanneeni teiltä mitään. Kenties raamattu.fi -kirjautuminen on syynä mailiinne? Toki palkinto kiinnostaa- sillä olen vähän haaveillut kronologisesta Raamatusta :-D  Vastaan lähes joka kysymykseen 5 sen takia- että en osaa varsinaisesti antaa palautetta palvelustanne.', '+-', 'En osaa vastata tähän.', 'En osaa ehdottaa kehitettävää-koska en ole käyttänyt sitä toistaiseksi.', 'En osaa sanoa. Kristillinen kirjakauppa tarpeellinen- kun kotipaikkakunnallani ei ole kirjakauppaa.', 'En juuri nyt osaa ideoida.', 'En osaa sanoa- koska en käytä nettipalveluita ainakaan vielä.', 'En osaa sanoa', 'Olen tyytyväinen. En osaa sanoa mitään kehitettävää.', 'En osaa sanoa', 'Olen niin vähän tekemisissä- etten osaa oikein sanoa mitään. Harvakseltaan kuitenkin hankin hengellistä aineistoa.', 'En osaa sanoa', 'En osaa sanoa', 'En osaa sanoa.', 'En osaa sanoa.', 'En osaa sanoa', 'En osaa sanoa', 'Valitettavasti en osaa sanoa kehitysideaa- mielestäni teillä on ihan toimivat sivut.', 'En osaa sanoa. Tietoja uutuuksista. Minua kiinnostaa myös englannin ja ruotsinkieliset ja antikvaariset kirjat. Kirjojen selailumahdollisuus.', 'En osaa sanoa.', 'En osaa sanoa.', 'En osaa sanoa', 'En osaa sanoa', 'En osaa sanoa', 'En  osaa tahan vastata kun olen vanha ja vasta opetellut taman kayton', 'En osaa sanoa', 'En osaa sanoa', 'En osaa sanoa.', 'En osaa sanoa', 'En osaa sanoa. Minä en tee enää tilauksia- joten en tarvitse viestejä.', 'En osaa sanoa- koska olen ""huono asiakas"" joka tapauksessa.', 'En osaa sanoa', 'On nyt oikein osaa sanoa', 'En osaa sanoa.', 'Enpä osaa sanoa', 'En osaa vastata tähän kysymykseen. En tunne markkinointialaa.', 'En osaa sanoa.', 'En osaa sanoa- ehkä joku mainosliite kuvien kanssa.', 'En kyllä osaa sanoa', 'En osaa sanoa', 'En osaa sanoa. Olen pienellä eläkkeellä en pysty enää ostamaan tuotteita vaikka haluaisin', 'En osaa sanoa.', 'En osaa sanoa', 'En osaa sanoa', 'En osaa nyt eritellä', 'En osaa sanoa', 'Nyt juuri en osaa sanoa mitään kehitettävää.', 'En osaa sanoa😉', 'En tällä hetkellä osaa ottaa kantaa.', 'En osaa sanoa nykyinen on toimiva tapa', 'En osaa toivoa mitään erityistä.', 'En osaa sanoa.', 'En osaa sanoa.', 'En osaa sanoa', 'En osaa sanoa', 'En osaa sanoa.', 'En osaa sanoa', 'En osaa sanoa', 'En osaa sanoa koska en ole saanut ainuttakaan viestiä', 'En osaa  sanoa tällä hetkellä.']",79,13,"['En osaa sanoa', 'En osaa sanoa.', 'En osaa sanoa', 'En osaa sanoa', 'En osaa sanoa', 'En osaa sanoa.', 'En osaa sanoa', 'En osaa sanoa', 'En osaa sanoa.', 'En osaa sanoa']"
2,"Kuvia, Tuotteista, Voisi","kuvia, tuotteista, voisi, selkeyttä, viesteihin, lisää, mukana, lisätä, värejä, mahdollista","['En ole tutustunut viesteihin aiemmin- mutta odottaisin esittelyä uusista tuotteista ja hyviä tarjouksia', 'Kuvia tuotteista- jos mahdollista', 'Ulkoasuun lisää kuvia ja ehkäpä sen voisi tehdä ihan uutiskirje ohjelmalla (MailChimp ilmainen)', 'Visuaalisuutta ja selkeyttä lisää. :)', 'Houkuttelevia-  selaimessa lukeminen?', 'Käyttäisin jotain uutis- tai markkinointikirjepohjaa- johon saisi kuvia ja nätisti linkit tuotteisiin.', 'Lisäämällä kuvia tuotteista', 'Enemän kuvia ja helpompi lukea', 'Kansikuvat (värikuvat) ja sisällön kuvailu voisivat lisätä kiinnostusta.Myös tarjousten kohdalla samoin.', 'Lyhyemmät ja ytimekkäämmät viestit. Kuvia tuotteista', 'Visuaalista ilmettä olisi hyvä parantaa. Nyt viestit ovat kuin listoja tuotteista mustalla tontilla. Väriä voisi olla ja kuvia.', 'En osaa sanoa. Ehkä kuvia tarjouksista ym. Kuvat yleensä nappaa ja selkeät hinnat !', 'Sähköpostissa helpot kuvakkeet jotka ohjaavat verkkosivuille. Toisaalta ei mitään isoja kuvia- koska ne paisuttaa viestien kokoa ja tukkii sähköposteja.', 'Mukana voisi olla kuvia tuotteista.', 'Liiallinen sähköpostiviestistä voi karsia asiakkaita- satunnainen ja muutama napakka poiminta parhaista tuotteista.', 'Kuvia myös viesteihin', 'Kuvia ja houkuttelevaa otsikointia pitäisi lisätä. Tämä varmaan kysyy budjettia- mutta voisiko hyödyntää opiskelijoita tai vaikka digiorientoituneitaa tuttuja?', 'Viesteihin selkeyttä. Kuvia.', 'Kuvia tuotteista voisi lisätä.', 'Sähköpostiviestit ovat ulkoasultaan tylsiä- kuin Muistiolla kirjoitettuja. Niihin tarvittaisiin ehdottomasti kuvia- värejä ja jotain muuta piristävää ja mielenkiintoa herättävää.', 'Lisäisin visuaalisuutta.', 'Vähemmän tuotteita- kuvia mukana', 'No miusta on ollut kiva kun niissä jaetaan- blogimaisesti kuulumisia. Se on ollut kivaa. Lisää sellaista lähestymistapaa.', 'Huippu hyvät tarjoukset houkuttelevasti. Mahdollisuus nähdä esim. tuotteista esim. kirjastä pätkä ja musiikista näyte.', 'Enemmän kuvia tuotteista', 'Joku kiinnostava haastattelu tai kirja-arvostelu mukana. Jotain joka palvelisi sunnuntain jumalanpalvelustekstin avaamista.', 'Haluaisin että viestintä pidettäisiin mahdollisimman yksinkertaisena ja lyhyenä. Ei tarvita kuvia eikä muita krumeluudeja; ne vain vievät tilaa ja täyttävät jo ennestään täynnä olevan sähköpostin.', 'Viesteissä voisi olla kuvia tuotteista.', 'Lisää gospel rock musiikkia ja tietokonepelejä.', 'Toivoisin kuvia- värejä- selkeyttä.', 'Arvioita- esittelyjä- viiteryhmiä tuotteille.', 'Lisää visuaalisuutta', 'Kirjakuvaukset ovat hyviä ja houkuttelevia- mutta kiireisenä ja visuaalisena ihmisenä en jaksa lukea niin pitkiä esittelyjä ilman kuvia! Kuvat yleensä houkuttelevat minut ostoksille..', 'Viesteihin voisi lisätä kuvia tuotteista. Ei kukaan jaksa kahlata kovin pitkää mainosviestiä läpi- jos siinä on pelkkää tekstiä.', 'Lisää grafiikkaa ja kuvia- parantakaa luettavuutta. Linkkejä lisää.', 'Selkeämpi jaottelu tarjouksiin- tuotteista kunnon esittely- kansikuva?', 'Lisäisin kuvia', 'Kuvia- selkeyttä lisää.', 'Kuvat tuotteista ei vain tekstiä ja linkkejä', 'Kauniita kuvia ja lohtusanoja ja viisauksia jotka voimaannuttaa. Lyhyitä ytimekkäitä viestejä ajankohtaisista jutuista koska informaatiotulva on tänä päivänä niin suurta.']",40,6,"['Mukana voisi olla kuvia tuotteista.', 'Kuvia tuotteista voisi lisätä.', 'Viesteissä voisi olla kuvia tuotteista.', 'Kuvia tuotteista- jos mahdollista', 'Enemmän kuvia tuotteista', 'Lisäämällä kuvia tuotteista', 'Kuvia- selkeyttä lisää.', 'Viesteihin selkeyttä. Kuvia.', 'Lyhyemmät ja ytimekkäämmät viestit. Kuvia tuotteista', 'Voisi olla enemmän kuvia']"
3,"Tiedä, Mitään, Kyselyn","tiedä, mitään, kyselyn, muuta, sähköpostiviesteihin, hyviä, outo, kysely, tarjouksia, päivän","['En tiedä', 'Kyselyssä olisi voinut olla kohta  Ei kokemusta  Valittavana. Niin olisi oikeampi', 'Selkeys on paras valtti. Pyrkikää siihen.', 'Arvonnat ovat mukavia. Päivän Sana sähköpostitse.', 'Vaikea sanoa- kestää kauan- kun katselee- mitä teillä on tarjolla- eikä aina tiedä- minkä otsikon alta mitäkin tavaraa löytyy.', 'En tiedä- kun en niitä saa- mutta uutiskirjeet ovat nykyisin aika spammia- eikä niitä kai kukaan enää halua- eli mitä vähemmän lähetätte mailia- sen vähemmän suututatte ihmisiä.', 'En tiedä.', 'Päivän Sana. Päivän rukous. En tiedä ovatko ne jo.', 'Kerran kuukauteen isommat tarjouset.. en tiedä..', 'En tiedä.', 'Minulle ei tule viikkotiedotetta- enkä siis tiedä niistä sen kummemmin- mutta selkeys tällaisissa hyvin tärkeää.', 'No en tiedä. Ei se liian kaupallinenkaan ulkoasu ole kiva- mutta liian ""jonomainen"" taas tylsistyttää- joten jotakin vähän pirtsakampaa... ?', 'En tiedä. ehkä hyviä tarjouksia sähköpostiviesteihin.', 'En tiedä.', 'En tiedä.', 'Minua häiritsi kyselyssä se- että kaikessa oli valmis oletus sen sijaan- että olisi ollut vaihtoehto en tiedä tai että en ole käyttänyt palvelua. En edes tiedä mitä kautta olen päätynyt listallanne. Siksi laitoin arvosanan keskelle niin moneen kun en tiennyt.', 'Kysely oli outo koska en tiedä mitä olen teiltä tilannut.', 'En tiedä siitä mitään muuta kuin tämän kyselyn.', 'Lyhyemmät ja selkeämmät viestit- joissa ei jatkuvasti tarvitsisi poiketa uudelle sivulle olisivat mukavia- mutta en kyllä tiedä- miten ne voisi toteuttaa...', 'En osaa sanoa. Enkä tiedä onko se tarpeenkaan! S-postia tulee jo nyt niin paljon- että siihen turtuu helposti.', 'En tiedä']",21,3,"['En tiedä.', 'En tiedä', 'En tiedä.', 'En tiedä', 'En tiedä.', 'En tiedä.', 'En tiedä siitä mitään muuta kuin tämän kyselyn.', 'En tiedä. ehkä hyviä tarjouksia sähköpostiviesteihin.', 'Kysely oli outo koska en tiedä mitä olen teiltä tilannut.', 'Kerran kuukauteen isommat tarjouset.. en tiedä..']"
4,"Eos, Tyytyväinen, Mitään","eos, tyytyväinen, mitään, kehitettävää, olllut, palveluun, nykyiseen, keksi, sähköpostiviestintään, viestintään","['Eos', 'Eos', 'Eos', 'Eos', 'Eos', 'Eos']",6,0,"['Eos', 'Eos', 'Eos', 'Eos', 'Eos', 'Eos']"
