Topic_id,Themes,Top_ten_words,Documents,Frequency_of_each_topic,Percentage_of_each_topic,Top_responses
6,"Hyvä, Näin, Tyytyväinen","hyvä, näin, tyytyväinen, juuri, nykyinen, toistaiseksi, uskonnollista, nykytilanne, äkkiä, hyvin","['Ei tule mieleen kehityskohteita.', 'Nykyinen on hyvä', 'Kertoisin sähköpostissa lyhyet tiivistelmät suosituiista uutuuksista. Näin saatetaan jo tehdäkin?', 'Näin on hyvä', 'Muutama napakka/tosi hyvä tarjous.', 'Ei tule mitään mieleen', 'Hyvin toimii varmaan kohderyhmälle... joku verkkokauppa olisi hyvä- jossa voisi etsiä teoksia. Sähköpostit ovat vähän tarpeettomia- jos ei osta mitään. Meneeköhän teidän aikanne hukkaan- esim. tarjouksia tehdessä jos niiden avulla ei osteta tuotteita.', 'Ennemän selaista kirjalisuutta kun mie ole ordotsiksi', 'En nyt näin äkkiä osaa sanoa', 'Otsikossa selkeä kuvaus', 'Maallikolle olisi hyvä ilmoittaa kirjoista ja kirjoittajista heidän taustaryhmänsä ( esim vapaakirkko- helluntailaiset- viidesläiset- lestadiolaiset) etc', 'Juuri nyt hyvä.', 'Olisi ihanaa tilata niin- ette tarvitsisi kirjautua joka kerta. Ehkä näin onkin jo en vain osaa käyttää koneita :D', 'Olen tyytyväinen nykyiseen sähköpostiviestintään.', 'On hyvä- että viestin voi lukea viestinä- eikä tarvitse klikata millekään sivulle. Linkki teoksen/tuotteen lisätietoihin on ollut hyvä!', 'Tällä hetkellä viikkoviestejä ei tule jostain syystä. Lyhyt ja selkeä viesti on paras! S-postia tulee paljon joten on hyvä kun tekstin tärkeimmät asiat voi lukea nopeasti.', 'Selkeä tuotteiden ryhmittely alaotsikoiden alle mahdollisine alennusprosentteineen tai muine erikoisehtoineen => houkuttelee kiireistäkin lukijaa silmäilemään viestin loppuun asti.', 'En keksi mitään fiksua.  Ne ovat jo riittävän ajankohtaisia- mikä on tärkeintä.', 'Nykyinen palvelee minua hyvin.', 'Nuoret hyvin huomioivaa - voi ollakin näin.', 'Kuvien lisääminen postiin- itsellä ainakin näkyy kännykällä pitkä tekstipötkö eikä sellaista juuri tule luettua.', 'Sähköpostimarkkinoinnin asiantuntijana sanoisin ettää on tärkeätä että sähklpostit näyttävät moderneilta.', 'Iskevämpiä', 'Miten säilyttää yrittäjän oma tyyli ja olla kuitenkin uudistuva ja ammattimainen?', 'Nykyinen viestintä hukkuu harmaaseen mainospostimassaan. Teemoja. Haastatteluja. Mielipiteitä.', 'On jo riirrävästi informatiivinen', 'Rauhaisaa Joulua teille ja Siunausta v. 2021', 'Olisi hyvä jos se ei olisi uskonnollista.', 'Olisi hyvä keskittyä inhimillisempään toimintaan ja unohtaa raha- sillä tosi rasittavaa kaikki radio Deit ja patmokset- TV7- kun kaikissa on se raha pääasiana- eikä ihmisten sielut eli meidän kristillisyydestä on tullut mammonakeskeistä eli tosi vaikea kuvitella- että kristus ja apostolit voisivat koskaan toimia näin.', 'Nykytilanne on hyvä', 'Kun et tunne minua  et voi laittaa:  hei Nimi  Loppuosan suosittelu liirum laarumi on jotain outoa salaliitto liity sähköpostilistalle. Yksinkertaisesti nettisivu riittää. Ja jos haluaa- niin laita nappi: jaa tämä nettisivu Somessa kavereille.   Ja nettisivulla PITÄÄ olla nämä sähköpostilistan mainokset ekana. !!!!!', 'Ne on välillä tosi pitkiä', 'Verkostoitumalla hyvin laajasti ja jatkuvasti yhä laajemmin.', 'Toistaiseksi hyvä näin!', 'Olen tutustunut sähköpostiviestintäänne niin lyhyen aikaa- ettei minulla ole tällä hetkellä kehittämisehdotuksia.', 'Olen tyytyväinen tähän nykyiseen malliin tai systeemiin Kristillinenkirjskaupan toimintaan.', 'Sähköpostit saisivat olla napakoita- muutama tarjous viestissä.', 'Mahdollisuus valita jokapäiväinen Raamatun sana sähköpostiin.   Turvakieltoni vuoksi Klarnan laskutus olisi tosi hyvä. Tulisi ostettua useammin teiltä- jos olisi tämä mahdollista.', 'Laskulla maksamisen mahdollisuus puuttuu- joten ei juurikaan tule tilattua mitään tätä kautta- sillä en osta juuri koskaan mitään jos pitää maksaa ennen kuin tuote on käsissä. Hintataso ei myöskään pärjää kilpailussa.', 'Tekstiä on liikaa. Viestissä olisi hyvä olla kuva tuotteesta ja linkki tuotteeseen kuvalinkki tms- mutta ei ainakaan tuollainen rivitolkulla kestävä linkkihirviö- jollainen se on nyt.', 'En osaa sanoa - näin yhtäkkiä', 'Viikottainen kuulostaa aika tiiviitä. Satunnaiset ostajat ei innostu. Kerta kuukaudessa tai kahdessa voisi olla hyvä. Pystyy viestimään esim tarjouksista maltilliseen tahtiin ja näin potentiaalisesti lisätä myyntiä ja säännöllisesti muistutella olemassa olosta. Mutta kerta viikkoon on tosiaan liian usein esim minun kaltaiselle asiakkaalle.  Asiakassegmentointia kannattaa tehdä niin että viestintä on enemmän kohdennettua ja puhuttelee juuri niitä parhaita asiakkaita. Sitten vähän harvemmin kohdentaa satunnaisiin yms asiakkaisiin.', ""Ne viestit jotka olen saanut ovat olleet riittävän informatiivisia. Suorat linkit ovat hyvä asia. En kaipaa kuvia enkä muutakaan kuvallista layout'ia."", 'Pitäkää nykyinen formaatti.', 'Olen ollut tyytyväinen palveluun.', 'En ole perehtynyt asiaan kehittämisen kannalta- minulle viestintä toimii nykyisellään hyvin', 'Hyvä että pysytään asiassa eikä kikkailla. Hyvä tuote myy- ei tarvita ylisanoja. Harvemminkin voisi lähettää viestejä.', 'Tässä kyselyssä ei ollut sellaista vaihtoehtoa että ei ole kokemusta jostain tietystä kyselyaiheesta. Esim minä en ole koskaan soittanut teidän asiakaspalveluun. Ei voinut arvioida kuin miten tyytyväinen on näihin kaikkiin osa-alueisiin.', 'Laittakaa linkki josta voin peruuttaa uutistilauksen.', 'Olen tyytyväinen jo voimassa olevaan', 'Ehkä kaipaan nettikirjoja tai ääneen luettuja kirjoja ? Samoin kaipaan kristillistä jopa englannin kielistä scifiä.', 'Olen olllut tyytyväinen.', 'En osaa sanoa. Hyvä kuitenkin että näin tulee tieto kotiin- vaikka joskus kaipaan kristillistä kivijalkamyymää.', 'Sähköpostiviestit voisi kyllä olla ulkoasultaan houkuttelevampia- yksi tuotekuva ainakin päämarkkinointituotteesta. Näin se tuo eloa sähköpostiviestiin.', 'Näin on hyvä.', 'Hyvä asiallinen- henkilökohtainen ote', 'Hyvä- jos viestit erottuisivat jotenkin. Olisi nostettu yksi tai kaksi asiaa ""ylitse muiden""- joita erityisesti toivotaan luettavan', 'Olen tyytyväinen', 'Ei tule mieleen kehitysideoita', 'Hyvin toimii.', 'Spostin hyvä puoli on se- että siitä voi tarvittaessa katsoa vähän kuin paperimainoksessa- mutta useimmiten ne lentävät roskakoriin ja muutoinkin hukkuvat toistensa sekaan. Niitä ei siis tule luettua kovinkaan paljon.  Mitä tilalle - kuka sen keksii varmaankin saa kauppaa aikaiseksi. Itse en oikein osaa sanoa.', 'Vaikken yleensä ole kovin innokas kannattamaan sitä- että eri tahot verkossa ""oppivat"" kulutuskäyttäytymistäni ja kiinnostuksen kohteitani- tässä saattaisi joku kategorisen tason vapaaehtoinen personointi olla ihan hyvä. Tyyliin olen/en ole kiinnostunut musiikista/korteista/x kirjallisuudesta/y kirjallisuudesta...', 'Toivon hyvin lyhyttä ja ytimekästä viestintää en jaksa tutkia pitkiä juttuja', 'En yleensä jaksa lukea juuri mainossähköpostia vaan karsin ne mahd. nopeasti.', 'En muista käyttäneeni tätä verkkokauppaa.', '👍enpä juuri osta verkosta- koska asun ison kaupungin keskustassa', 'Ei mitään tietoa. En muista käyttäneeni tätä palvelua koskaan.', 'Viesteissä on mielestäni tarpeellinen tieto ja linkeistä pääsee sivuille- jossa voi tutustua tuotteeseen paremmin.', 'En osaa sanoa. Olen tyytyväinen tähän näin.', 'Erikoistarjoukset tummennettuina', 'Soisin tekstiviestillä saanti mahdollisuus.']",71,11,"['Näin on hyvä', 'Näin on hyvä.', 'Toistaiseksi hyvä näin!', 'Juuri nyt hyvä.', 'Nykyinen on hyvä', 'Olisi hyvä jos se ei olisi uskonnollista.', 'Nykytilanne on hyvä', 'En osaa sanoa. Olen tyytyväinen tähän näin.', 'En osaa sanoa. Hyvä kuitenkin että näin tulee tieto kotiin- vaikka joskus kaipaan kristillistä kivijalkamyymää.', 'Muutama napakka/tosi hyvä tarjous.']"
7,"Ok, Ihan, Tyytyväinen","ok, ihan, tyytyväinen, kiinostavaa, kehitystarpeita, viestintä, jokin, raamatunjae, hartauskirjoitus, tms","['Ok', 'No ovat riittävän hyviä', 'Viikolle vain muutama erikoistarjous + valikoidut uutuudet. Selkeys- yksinkertaisuus. Pieni on kaunista.', 'Ihan ok', 'En keksi tähän mitään.', 'Siinäpä se- informaatiotulva on ihan uskomaton- ne jotka erottuvat massasta- ne pärjäävät. Hengellisten kirjojen myynti ei ole kadehdittava laji...', 'Ok', 'Ihan hyviä ovat- en keksi kehitettävää', 'En osaa sanoa- ovat ihan ok.', 'Mainokset ja viestintä niille jotka pyytää- muut rauhaan.', 'Olen ollut ihan tyytyväinen viestintään.', 'Ok', 'Mielestäni ne ovat nyt ihan hyviä- tuotekuvaukset ja linkit löytyy', 'Viestintä on minusta ihan ok. Kiinostavaa. En osaa sanoa kehitystarpeita.', 'Sähköpostissa voiso olla hyviä lukuvinkkejä', 'Tuotevalikoiman esittely', 'Olen ihan tyytyväinen- en osaa sanoa muuta- kun en osaisi itse kehittää niitä', 'En keksi ideaa', 'Ihan asiallinen- mutta siinä voisi olla jotain teemaa pelkkien listojen lisäksi.  Jokin esittely tai kirjoitus tms.  per viesti', 'Jokin pieni hartauskirjoitus voisi olla ihan ok. Raamatunjae tms.', 'Vaikks jokin ajankohtainen rohkaiseva ajatus Jumalasta']",21,3,"['Ihan ok', 'Ok', 'Ok', 'Ok', 'En osaa sanoa- ovat ihan ok.', 'Viestintä on minusta ihan ok. Kiinostavaa. En osaa sanoa kehitystarpeita.', 'Jokin pieni hartauskirjoitus voisi olla ihan ok. Raamatunjae tms.', 'Viestejä ei tulisi liianusein- esim. Kerran kuussa ok', 'Olen ollut ihan tyytyväinen viestintään.', 'Ihan hyviä ovat- en keksi kehitettävää']"
8,"Kerran, Kuussa, Riittäisi","kerran, kuussa, riittäisi, kuukaudessa, viestit, liian, viesti, usein, tulisi, viikossa","['En ole tilannut tätä viestiä- koska Sähköpostia tulee jo muutenkin liikaa. Kerran kuukaudessa olisi ehdoton maksimi.', 'Max kerran kuukaudessa', 'Lähetystiheydeksi riittäisi 1-2 krt / kk.', 'Ei kahta kertaa samaa viestiä', 'Tv mainonta', 'Riittäisi- että kerran kuussa tulisi sähköpostiviesti.', 'Yksi tarjouskirje kerran vuodessa', 'Kaksi ktr kk riittäisi- tarjoukset nettikaupassa', 'Tekisin niistä hienomman näköisiä', 'Viestejä ei tulisi liianusein- esim. Kerran kuussa ok', 'Sähköpostiviestejä ei tarvitse lähettää liian usein- vaan silloin- kun on oikeasti tiedotettavaa.', 'En tunne viestintää tarpeeksi.', 'Minulle riittäisi lyhyemmätkin viestit (ja linkki ao. tuotteen sivulle).', 'Mielestäni posteissa pitäisi olla kirjoista lyhyt selostus vaikkakin vain yhden tai muutaman lukijan kannalta.', 'En muista kuinka usein viestit tuli kun uutiskirjettä joskus tilasin. Mutta liian usein- koska siksi sen peruin kun taloustilanne ei anna kovin usein tilata kirjoja ja sähköposteissq oli aina kiinnostavia kirjoja :D', 'Olen tilannut teiltä aikaisemmin 2 kertaa ja minulle tulee sähköpostiviestit kahtena. Nyt tilasin kolmannen kerran. Tuleekohan nyt kolminkertaisena?', 'Viikottaiset viestit ovat liian paljon kun muutenkin tulee postia ja ei jaksa keskittyä kaikkeen.', 'Pari kertaa kuukaudessa oilisi mieluisampaa.', 'En tunne asiaa', 'No- ihmettelin kyselyä- kun en kai ole tilannut teiltä kuin kerran tai kahdesti? Kysymyksiin vastaaminen oli siksi vaikeaa- mutta muistaakseni sähköpostitilauksessa ei ollut ongelmia. Muistaakseni pyysin silloin paperilaskun mukaan- en ole varma.', 'Olen saanut- mutta irtisanouduin viesteistä', 'Kerran kuussa olisi sopiva niin ehtii lukea.', 'Lyhyitä tarjousviestejä esim. 1X/kk- kerran viikossa on ehkä liian usein', 'Viestit voisivat olla HTML-muodossa.', 'Viestit voisivat olla nyjyaikaisemman näköisiä', 'Kerran viikossa on ehdottomasti liian paljon- kerran kuukaudessakin siinä rajoilla.', 'Kuvallisia- lyhyempiä kuin nykyään.', 'Sopiva määrä riittävän selkeitä', 'Sähköpostia tulee paljon- joten tällaisten mainospostien kannattaisi sisällöllisesti olla mahdollisimman tiiviitä- ehkä myös kohdennettua?', 'Viestit ovat hyvin lämpimiä- nimellä tulevia- ihan kuin just vain sinä saisit sen! Luen kyllä ne- mutta niinkuin sanoin haluan kädessäni katsella niitä! Pitäkääpä sellaisia kirjakauppa päiviä uutuuksilla- sesonkituotteille- varmoille tuotteille jossain paikan päällä! Jonkun kerran vuodessa!', 'Kerran kuussa riittäisi', 'Kerran kuussa voisi olla parempi ja siihen sellaisia tuotteita jotka ovat uusinta uutta ja jotka varmasti kiinnostavat- tai sitten klassikoita- pienellä markkinointipuheella- miel. myös suosituskirjoituksia teoksille (esim. esipuhe tai todistus siitä mitä kirja/musiikki saanut aikaan/herättänyt tunteita etc.)', 'Uusi viesti yhden kerran viikon aikana päiväsaikaan.', 'Tulee miettiä- miten nuoret saadaan mukaan!!!', 'Kerran kuukaudessa olisi riittänyt', 'Mielelläni ottaisin vastaan infoa kirjoista Pidän kirjojen tietoja esim kirjoittajasta liian puutteellisena- samoin sisällöstä.', 'Selkeämmät viestit- on pienellä tekstillä', 'Pelkkänä tekstimuotona ei usein herätä kiinnostusta. Jos olisi kuvallinen mainos- niin kiinnittäisi herkemmin huomion.', 'Tänä aikana kaikenlainen tarjonta kuormittaa !', 'Lähetyskulut tiettyn summan ylittyessä lähetyskulut tulisi 0€.', 'Haluaisin määritellä myös kirjoittajien ja tuotteiden mukaan joista minulle tulisi iömoitus jos jotain on saatavilla tai uutuutena.', 'Kerran viikossa kuulostaa isolta määrältä. Itse vältän uutiskirjeitä koska postia tulee muutenkin liikaa', 'Moi viestit hyviä Lyhyt esitys linkkeineen - pikainen vilkaisu herättää kiinnostuksen jos on herättääkseen.', 'Niissä pitäisi painottaa tai suorastaan keskittyä pelkästään (uutuus)sisältöihin- ei lainkaan hintaan.', 'Viikottain olisi aivan liian usein- poistuisin postituslistalta- jos näin usein tulisi. Kerta kuukauteen riittäisi.', 'Kerran kuussa isompi mainos- jossa kooste eri tuoteluokista ja uutuuksista.', 'Kerran kk tuleviksi- ei viikottain', 'Sähköpostia kerran kuukaudessa- jossa monipuolista tarjontaa.', 'Ostan äärimmäisen harvoin mitään- joten viestit kelpaavat minulle tällaisinaankin.', 'Kiinnostavia viestejä-ajankohtaisia.', 'Napakat viestit jaksaa lukea- ei pitkiä koska tulee paljon tietotulvaa nykypäivänä.', 'Helppolukuisuus- lyhyt ja ytimekäs mainonta', 'Olen poistanut itseni aina kaikista sähköpostilistoista- koska en jaksa valtavaa viesti tulvaa- mitä nykyään tulee. Etsin googlaamalla sitten- kun joku asia on ajankohtainen.', 'En ole ikinä kuullutkaan tällaisesta KristillinenKirjakauppa.fi -nettikaupasta! Siksi jätin edellisen sivun kyselyn vaihtoehdot kokonaan vastaamatta- kun ei ollut minkäänlaista kokemusta tai tietoa. Toivon- että minulle ei edelleenkään ala tulla teiltä joka viikko sähköpostia. Niin lyhyen postitusvälin koen häirinnäksi. Eihän kukaan terve ihminen eikä varsinkaan seurakunnan työntekijä osta kirjaa tai ylipäätään mitään kirjakauppatavaraa JOKA VIIKKO. 4 - 6 kertaa vuodessa sähköposti olisi mielestäni sopiva. Muussa tapauksessa pysyttelen edelleen sähköpostilistanne ulkopuolella.', 'Enemmän kuvia yms. voisi olla viesteissä- sekä säännöllisesti esim. 2kk kertaa kuussa viestintää. Ei liian usein- esim. kerran viikossa on liian usein omasta mielestäni ja silloin helposti alan ignoorata viestejä', 'Ottaisin rinnalle html-muotoisen s-postin. Tämä siis ehdottomasti rinnalle- ei korvaamaan- jolloin jokaisen oma s-posti-ohjelma näyttää sen ""halutun"" formaatin. @gmailissa tulee vastaan sellainen ongelma- että text/plain-viestit yrittävät käyttää koko leveyden- jolloin lukemisesta tulee todella hankalaa.  Html-muotoisessa s-postissa voidaan asettaa maksimileveyksiä ja muutenkin nostaa tiettyjä osioita paremmin esille.  Ja kyllä-@gmailin ongelmahan tuo on- mutta uskon se olevan sen verran yleinen palvelu- että aika moni saattaa kärsiä samasta vaivasta.', '- Säännöllinen sähköpostikirje.  - Kirkkovuosikalenteri mukaan kirjeeseen. Moni ei tunne seurakunnan kirkkovuotta.   - Viikon Raamatunteksti.', 'Jos tulee- en lue- on niin paljon postia', 'Uusien kirjojen esittely n.1x kk', 'Yleensä jos tarjousposteja tulee viikoittain joltakin firmalta niin hyvin äkkiä peruuttaa niitten kirjeitten tilauksen. Kerran kuussa on hyvä väli.', 'Ulkoasuun kiinnittäisin huomiota.', 'Viestit kerran kuussa.', 'Liian usein', 'Sähköpostien pitäisi sisältää vain lyhyt- vaihtuva viesti. Esim. Pari kolme tarjousta.', 'Minusta viikottain riittää sähköpostin lähettäminen hyvin.', 'Ei tuu mielee♥️☕👼', 'Viesti- jos asiakas niin haluaa. Itselläni on suoramarkkinointikielto.', 'Ulkoasuun kannattaisi kiinnittää huomiota. Minulle riittäisi pari kertaa kuukaudessa. Jokaviikkoinen viesti on vähän liian paljon.', 'Olen pyytänyt lopettamaan niiden lähettämisen. Viestit ovat minulle tarpeettomia ja liian pitkiä.', 'Viestit eivät saa olla liian pitkiä.Mieluummin lyhyitä useammin.', 'Viesti kuukausittain (esm. ale kampanjat ja uutuudet) olisi kivaa tukea jonkinlaista lähetystyötä lähettämällä kauttanne ulkomaankielisiä Raamattuja maihin joissa Raamatut on liian kalliita tai vaikeasti saatavilla.', 'Tekisin kohderyhmäviestintää. Asiakkaiden profilointi esim. ikäryhmän ym. kriteerin mukaan ja sen jälkeen kohderyhmäspesifiä viestintää.', 'Kaksi sähköpostia olen laittanut- että poistakaa minut listoiltanne ja edelleen näitä tulee', 'I would love to get the newsletters in ENGLISH.', 'En ehdi luke. Yleensä en kiinnitä huomiota kun niin paljon.', 'En tunne kiinostusta henkilökohtaisesti.', 'Tulee vähä nopzzzaaan kysymyyys', 'Selkeät- lyhyet ja ytimekkäät viestit. Hyvät tarjoukset.', 'Max 3 asiaa /viesti kuvan kera', 'Viestit on liian sumputettuja- selkeämpi linja ja jaottelu mielestäni .voisi olla', 'Minulle riittäisi viesti kerran kuukaudessa.', 'Tulen itse kauppaan- jos tarvitsen jonkun tuotteen', 'Säännöllinen tarjonta. Viikkorytmi ehkä vähän liian tiivis.', 'Viestin sisältö napakan lyhyt- linkkejä laajempiin listoihin.', 'Lyhyt viesti', 'Kerran pari kuukaudessa riittäisi. Viestissä voisi käyttää kuvia tai värejä. Helpommin kiinnosvat kohteet nousisivat näin esille.', 'Voitteko lopettaa uutiskirjeeni- jota en ole edes tilannut?', 'En ehdi lukemaan sähköpostia joka viikko', 'Selkeät ja tarpeeksi lyhyet viestit- joissa esim uutuudet selvästi näkyvissä sekä kaikki tarjouskirjat ja muut tuotteet. Sopiva postitusväli on esim 2 kertaa kuussa.  Viestikirjeestä pitäisi olla suora klikkausmahdollisuus ko tuotteeseen.']",89,14,"['Kerran kuussa riittäisi', 'Minulle riittäisi viesti kerran kuukaudessa.', 'Viestit kerran kuussa.', 'Riittäisi- että kerran kuussa tulisi sähköpostiviesti.', 'Max kerran kuukaudessa', 'Kerran kuukaudessa olisi riittänyt', 'Kerran kuussa olisi sopiva niin ehtii lukea.', 'Kerran viikossa on ehdottomasti liian paljon- kerran kuukaudessakin siinä rajoilla.', 'Sähköpostia kerran kuukaudessa- jossa monipuolista tarjontaa.', 'Viestejä ei tulisi liianusein- esim. Kerran kuussa ok']"
9,"Harvemmin, Riittäisi, Värikkäämmin","harvemmin, riittäisi, värikkäämmin, vähän, parempi, viestejä, näyttävämmän, näköiseksi, sähköpostiviestejä, lähettää","['Hieman harvemmin mainosviestejä- kiitos!', 'Ei sanottavaa', 'Harvemmin riittäisi.', 'Viikkoviesti aivan liian usein jos ottaa huomioon miten monelta muulta taholta tulee markkinointiviestejä- ei niitä ehdi lukea ja siksi en halua vastaanottaa joka vk. Harvemmin ja lyhyt ja ytimekäs toimii- asiakas voi halutessaan tutustua paremmin asiaan', 'Viikkoviestit ja selväksi', 'Viestejä voisi tulla harvemmin ja tarjoukset voisi olla parempia.', 'Jätän teidän huoleksi', 'Ulkoasusta informatiivisempi', 'Vähän harvemmin. Minä olen kohteena epäkiitollinen- kun en paljon hyviäkään mainoksia lue enkä tee heräteostoksia. Ostan siis harvoin.', 'E-kirjoja', 'Käytän vähän- ei erityistä sanottavaa.', 'Raju viikon tarjous isolla ja sitten muuta vähän ja pienellä.', 'Kampanjoita ""juhla-aikojen"" läheisyyteen.', 'Katso edellinen vastaukseni.', 'Ei kemmenttia.', 'Ne voisivat olla hieman tiiviimpää.', 'Ajan hermolla', 'Ei mielipidettä', 'Pitäisi tulla harvemmin- että niitä tulisi luettua. Usein en edes avaa niitä- kun ne hukkuvat roskapostiin.', 'Jeesus', 'Uutuudet- tarjouskampanjat ja jokin poiminta/suositus josta hieman laajemmin kerrottu', 'Harvemmin- mutta värikkäämmin. :)', 'Harvemmin riittäisi. Ja ehkä isompiin kokonaisuuksiin sovellettuna- niin ettei kaikkea tarvitsisi lukea- jos jostakin on kiinnostunut esim. musiikki- hartauskirjallisuus- lahjat jne.', 'Sähköpostiviestejä voisi lähettää harvemmin.', 'Harvemmin viestejä', 'Näyttävämmän näköiseksi ja harvemmin', 'Suppeampia kooltaan', 'Itse en niitä edes katso kun sähköpostiin tippuu koko ajan mainoksia. En lue niitä vaan poistan yleensä samantien.', 'Harvemmin', 'Harvemmin ja otsikko houkuttelevaksi. Tarjoukset vrt.aiemmat tilaukset.', 'Blogeja Raamatusta', 'Vähän harvemmin olisi parempi.', 'Ei toiveita', 'Saisko niihin vähän enempi eloa vaikka nostamalla jokin uutuus kuvan kanssa esiin?', 'Harvemmin.']",35,5,"['Harvemmin.', 'Harvemmin', 'Harvemmin viestejä', 'Harvemmin riittäisi.', 'Harvemmin- mutta värikkäämmin. :)', 'Vähän harvemmin olisi parempi.', 'Näyttävämmän näköiseksi ja harvemmin', 'Sähköpostiviestejä voisi lähettää harvemmin.', 'Hieman harvemmin mainosviestejä- kiitos!', 'Viestejä voisi tulla harvemmin ja tarjoukset voisi olla parempia.']"
